{"package_id":"L1-domain-a","level":"L1","version":"1","content_hash":"20202020","sources":[{"artifact_id":"REQ-1","version":"1","content_hash":"bbbbbbbb"}],"dependencies":["L0"],"read_scope":["design.md#domain-a"],"write_scope":[],"created_at":"2026-01-01T00:11:00Z","canonicalization_version":"1"}
