{"package_id":"L2-1","level":"L2","version":"1","content_hash":"ffffffff","sources":[{"artifact_id":"SPEC-1","version":"1","content_hash":"cccccccc"}],"dependencies":["L1-domain-a","L1-domain-b","CONTRACT-1@1"],"read_scope":["src/domain-a","src/domain-b"],"write_scope":["src/domain-a"],"created_at":"2026-01-01T00:15:00Z","canonicalization_version":"1"}
